{
  "$schema": "https://json-schema.org/draft/2020-12/schema",
  "$id": "copyflow/listing.schema.json",
  "title": "Listing 平台文案（一个平台 × 一个市场）",
  "description": "第一版只覆盖 amazon 与 shopee。新增平台 = 在 $defs 里加一个 content 结构，并在 allOf 里加一条 if/then。长度、违禁词等业务规则不写在这里，交给规则引擎。",
  "type": "object",
  "additionalProperties": false,
  "required": ["platform", "market", "content", "attributes", "qa", "claims"],
  "properties": {
    "platform": { "enum": ["amazon", "shopee"] },
    "market": { "type": "string", "pattern": "^[a-z]{2}-[A-Z]{2}$" },
    "content": { "type": "object" },
    "attributes": {
      "type": "array",
      "items": {
        "type": "object",
        "additionalProperties": false,
        "required": ["name", "value", "fact_ids"],
        "properties": {
          "name": { "type": "string", "minLength": 1 },
          "value": { "type": "string", "minLength": 1 },
          "fact_ids": { "$ref": "#/$defs/factIds" }
        }
      }
    },
    "qa": {
      "type": "array",
      "items": {
        "type": "object",
        "additionalProperties": false,
        "required": ["question", "answer", "fact_ids"],
        "properties": {
          "question": { "type": "string", "minLength": 1 },
          "answer": { "type": "string", "minLength": 1 },
          "fact_ids": { "$ref": "#/$defs/factIds" }
        }
      }
    },
    "claims": {
      "type": "array",
      "description": "文案里每条卖点性陈述及其依据。没有事实编号的卖点无法在这里表达，即视为无依据。",
      "items": {
        "type": "object",
        "additionalProperties": false,
        "required": ["text", "path", "fact_ids"],
        "properties": {
          "text": { "type": "string", "minLength": 1 },
          "path": { "type": "string", "minLength": 1, "description": "该陈述所在字段，如 content/bullets/0/text" },
          "fact_ids": { "$ref": "#/$defs/factIds" }
        }
      }
    }
  },
  "allOf": [
    {
      "if": { "properties": { "platform": { "const": "amazon" } }, "required": ["platform"] },
      "then": { "properties": { "content": { "$ref": "#/$defs/amazonContent" } } }
    },
    {
      "if": { "properties": { "platform": { "const": "shopee" } }, "required": ["platform"] },
      "then": { "properties": { "content": { "$ref": "#/$defs/shopeeContent" } } }
    }
  ],
  "$defs": {
    "factIds": {
      "type": "array",
      "minItems": 1,
      "items": { "type": "string", "pattern": "^F[0-9]+$" }
    },
    "amazonContent": {
      "type": "object",
      "additionalProperties": false,
      "required": ["title", "bullets", "description"],
      "properties": {
        "title": { "type": "string", "minLength": 1 },
        "bullets": {
          "type": "array",
          "minItems": 5,
          "maxItems": 5,
          "items": {
            "type": "object",
            "additionalProperties": false,
            "required": ["heading", "text"],
            "properties": {
              "heading": { "type": "string", "minLength": 1 },
              "text": { "type": "string", "minLength": 1 }
            }
          }
        },
        "description": { "type": "string", "minLength": 1 }
      }
    },
    "shopeeContent": {
      "type": "object",
      "additionalProperties": false,
      "required": ["title", "highlight", "features", "promo_tags"],
      "properties": {
        "title": { "type": "string", "minLength": 1 },
        "highlight": { "type": "string", "minLength": 1 },
        "features": { "type": "array", "minItems": 1, "items": { "type": "string", "minLength": 1 } },
        "promo_tags": { "type": "array", "items": { "type": "string", "minLength": 1 } }
      }
    }
  }
}
