{
  "platform": "amazon",
  "market": "en-US",
  "content": {
    "title": "HoverGo Pro Wireless Earbuds, Active Noise Cancelling, Bluetooth 5.3",
    "bullets": [
      {
        "heading": "Active Noise Cancelling",
        "text": "Cuts down background noise on the train, in the office, or on a busy street so you can focus on your music and calls."
      },
      {
        "heading": "Up to 30 Hours of Playtime",
        "text": "The charging case extends total battery life to about 30 hours, so a full week of commuting needs far fewer charges."
      },
      {
        "heading": "Stable Bluetooth 5.3",
        "text": "Bluetooth 5.3 keeps a steady wireless connection with your phone and other paired devices."
      },
      {
        "heading": "IPX5 Water Resistance",
        "text": "Rated IPX5 to handle sweat and light rain during runs and gym sessions."
      },
      {
        "heading": "Made for Everyday Wear",
        "text": "A wireless design made for commuting, working out, and everything in between."
      }
    ],
    "description": "HoverGo Pro pairs active noise cancelling with a long-lasting charging case, Bluetooth 5.3 connectivity, and IPX5 water resistance, making it a practical everyday choice for commuters and active users.",
    "item_highlights": [
      "Up to 30 hours playtime with charging case",
      "IPX5 water resistant",
      "Bluetooth 5.3"
    ]
  },
  "attributes": [
    {
      "name": "Connectivity",
      "value": "Bluetooth 5.3",
      "fact_ids": [
        "F1"
      ]
    },
    {
      "name": "Battery life",
      "value": "Up to 30 hours with charging case",
      "fact_ids": [
        "F3"
      ]
    },
    {
      "name": "Water resistance",
      "value": "IPX5",
      "fact_ids": [
        "F4"
      ]
    }
  ],
  "qa": [
    {
      "question": "Do these earbuds have noise cancelling?",
      "answer": "Yes, they feature active noise cancelling.",
      "fact_ids": [
        "F2"
      ]
    },
    {
      "question": "How long does the battery last?",
      "answer": "Up to about 30 hours in total when using the charging case.",
      "fact_ids": [
        "F3"
      ]
    },
    {
      "question": "Are they sweat resistant?",
      "answer": "They are rated IPX5 for water resistance.",
      "fact_ids": [
        "F4"
      ]
    }
  ],
  "claims": [
    {
      "text": "Cuts down background noise",
      "path": "content/bullets/0/text",
      "fact_ids": [
        "F2"
      ]
    },
    {
      "text": "about 30 hours",
      "path": "content/bullets/1/text",
      "fact_ids": [
        "F3"
      ]
    },
    {
      "text": "Bluetooth 5.3",
      "path": "content/bullets/2/text",
      "fact_ids": [
        "F1"
      ]
    },
    {
      "text": "Rated IPX5",
      "path": "content/bullets/3/text",
      "fact_ids": [
        "F4"
      ]
    },
    {
      "text": "A wireless design",
      "path": "content/bullets/4/text",
      "fact_ids": [
        "F1"
      ]
    },
    {
      "text": "Up to 30 hours playtime",
      "path": "content/item_highlights/0",
      "fact_ids": [
        "F3"
      ]
    },
    {
      "text": "IPX5 water resistant",
      "path": "content/item_highlights/1",
      "fact_ids": [
        "F4"
      ]
    },
    {
      "text": "Bluetooth 5.3",
      "path": "content/item_highlights/2",
      "fact_ids": [
        "F1"
      ]
    }
  ]
}